{
  "schema_version": "1.0.0",
  "snapshot_id": "PLANNING-SNAPSHOT-001",
  "workspace_id": "11111111-1111-4111-8111-111111111111",
  "plan": {
    "plan_id": "PERICIAL-PLAN-001",
    "title": "Plano pericial sintético",
    "workspace_id": "11111111-1111-4111-8111-111111111111",
    "case_analysis_snapshot_id": "ANALYSIS-001",
    "case_analysis_revision": 1,
    "case_analysis_source_revision": 4,
    "case_analysis_digest": "66df53a0217c7da396382a5aee91f50a38aca0801d68717e2a267ddcfe8e2809"
  },
  "objectives": [
    {
      "item_id": "PLAN-OBJECTIVE-001",
      "title": "Preparar exame do objeto delimitado",
      "description": "Planejar a obtenção de elementos necessários ao exame do objeto pericial.",
      "priority": "HIGH",
      "derivation": {
        "rationale": "O objeto pericial delimitado exige preparação específica.",
        "case_analysis_item_ids": ["OBJECT-001"],
        "source_provenance": [{"workspace_id":"11111111-1111-4111-8111-111111111111","source_document_id":"DOC-002","source_document_sha256":"bbbbbbbbbbbbbbbbbbbbbbbbbbbbbbbbbbbbbbbbbbbbbbbbbbbbbbbbbbbbbbbb","page_or_span":"p. 6, §5","source_revision":4,"occurrence_id":"OCC-OBJECT-001"}],
        "question_ids": [], "pericial_object_ids": ["OBJECT-001"], "court_decision_ids": [], "technical_document_reference_ids": [], "gap_or_conflict_ids": []
      },
      "proposal_status": "PROPOSED",
      "professional_review_status": "APPROVED"
    }
  ],
  "issues": [
    {
      "item_id": "PLAN-ISSUE-001", "title": "Controvérsia documental", "description": "Considerar a divergência documental no preparo da diligência.", "priority": "HIGH",
      "derivation": {"rationale":"A análise registra conflito ainda sujeito a revisão.","case_analysis_item_ids":["CONFLICT-001"],"source_provenance":[{"workspace_id":"11111111-1111-4111-8111-111111111111","source_document_id":"DOC-001","source_document_sha256":"aaaaaaaaaaaaaaaaaaaaaaaaaaaaaaaaaaaaaaaaaaaaaaaaaaaaaaaaaaaaaaaa","page_or_span":"p. 3, §2","source_revision":4,"occurrence_id":"OCC-CLAIM-001"}],"question_ids":[],"pericial_object_ids":[],"court_decision_ids":[],"technical_document_reference_ids":[],"gap_or_conflict_ids":["CONFLICT-001"]},
      "proposal_status":"PROPOSED","professional_review_status":"PENDING"
    }
  ],
  "question_links": [
    {
      "item_id":"PLAN-QUESTION-LINK-001","title":"Preparação orientada ao quesito","description":"Relacionar o quesito aos elementos planejados sem antecipar resposta.","priority":"HIGH",
      "derivation":{"rationale":"O quesito pertinente deve orientar a coleta futura.","case_analysis_item_ids":["QUESTION-001"],"source_provenance":[{"workspace_id":"11111111-1111-4111-8111-111111111111","source_document_id":"DOC-001","source_document_sha256":"aaaaaaaaaaaaaaaaaaaaaaaaaaaaaaaaaaaaaaaaaaaaaaaaaaaaaaaaaaaaaaaa","page_or_span":"p. 7, item 1","source_revision":4,"occurrence_id":"OCC-QUESTION-001"}],"question_ids":["QUESTION-001"],"pericial_object_ids":[],"court_decision_ids":[],"technical_document_reference_ids":[],"gap_or_conflict_ids":[]},
      "proposal_status":"PROPOSED","professional_review_status":"PENDING","question_id":"QUESTION-001","linked_item_ids":["PLAN-MEASUREMENT-001","PLAN-EQUIPMENT-001","PLAN-METHOD-001"],"dependency_item_ids":[]
    }
  ],
  "required_documents": [
    {
      "item_id":"PLAN-DOCUMENT-001","title":"Documento técnico complementar","description":"Solicitar o anexo técnico indicado como indisponível.","priority":"HIGH",
      "derivation":{"rationale":"A lacuna documental pode limitar o exame.","case_analysis_item_ids":["GAP-001"],"source_provenance":[{"workspace_id":"11111111-1111-4111-8111-111111111111","source_document_id":"DOC-001","source_document_sha256":"aaaaaaaaaaaaaaaaaaaaaaaaaaaaaaaaaaaaaaaaaaaaaaaaaaaaaaaaaaaaaaaa","page_or_span":"p. 3 (anexo tecnico mencionado)","source_revision":4,"occurrence_id":"OCC-GAP-001"}],"question_ids":[],"pericial_object_ids":[],"court_decision_ids":[],"technical_document_reference_ids":[],"gap_or_conflict_ids":["GAP-001"]},
      "proposal_status":"PROPOSED","professional_review_status":"PENDING","document_description":"Anexo técnico mencionado nos autos","required_before":"INSPECTION"
    }
  ],
  "required_information": [
    {
      "item_id":"PLAN-INFORMATION-001","title":"Informação de acesso","description":"Obter previamente as condições de acesso ao local.","priority":"MEDIUM",
      "derivation":{"rationale":"A diligência depende de acesso ao objeto delimitado.","case_analysis_item_ids":["OBJECT-001"],"source_provenance":[{"workspace_id":"11111111-1111-4111-8111-111111111111","source_document_id":"DOC-002","source_document_sha256":"bbbbbbbbbbbbbbbbbbbbbbbbbbbbbbbbbbbbbbbbbbbbbbbbbbbbbbbbbbbbbbbb","page_or_span":"p. 6, §5","source_revision":4,"occurrence_id":"OCC-OBJECT-001"}],"question_ids":[],"pericial_object_ids":["OBJECT-001"],"court_decision_ids":[],"technical_document_reference_ids":[],"gap_or_conflict_ids":[]},
      "proposal_status":"PROPOSED","professional_review_status":"PENDING","information_description":"Condições e horário de acesso","requested_from":"RESPONSIBLE_PARTY"
    }
  ],
  "inspection_requirements": [
    {
      "item_id":"PLAN-INSPECTION-001","title":"Inspeção do objeto","description":"Inspecionar visualmente o objeto pericial delimitado.","priority":"HIGH",
      "derivation":{"rationale":"O objeto delimitado requer observações de campo futuras.","case_analysis_item_ids":["OBJECT-001"],"source_provenance":[{"workspace_id":"11111111-1111-4111-8111-111111111111","source_document_id":"DOC-002","source_document_sha256":"bbbbbbbbbbbbbbbbbbbbbbbbbbbbbbbbbbbbbbbbbbbbbbbbbbbbbbbbbbbbbbbb","page_or_span":"p. 6, §5","source_revision":4,"occurrence_id":"OCC-OBJECT-001"}],"question_ids":[],"pericial_object_ids":["OBJECT-001"],"court_decision_ids":[],"technical_document_reference_ids":[],"gap_or_conflict_ids":[]},
      "proposal_status":"PROPOSED","professional_review_status":"PENDING","inspection_target":"Objeto pericial sintético","field_observations_needed":["Condições aparentes","Limites acessíveis"]
    }
  ],
  "measurement_requirements": [
    {
      "item_id":"PLAN-MEASUREMENT-001","title":"Medição dimensional proposta","description":"Preparar medição dimensional pertinente ao objeto.","priority":"MEDIUM",
      "derivation":{"rationale":"O quesito pode exigir dimensão verificável sem antecipar resultado.","case_analysis_item_ids":["QUESTION-001","OBJECT-001"],"source_provenance":[{"workspace_id":"11111111-1111-4111-8111-111111111111","source_document_id":"DOC-001","source_document_sha256":"aaaaaaaaaaaaaaaaaaaaaaaaaaaaaaaaaaaaaaaaaaaaaaaaaaaaaaaaaaaaaaaa","page_or_span":"p. 7, item 1","source_revision":4,"occurrence_id":"OCC-QUESTION-001"},{"workspace_id":"11111111-1111-4111-8111-111111111111","source_document_id":"DOC-002","source_document_sha256":"bbbbbbbbbbbbbbbbbbbbbbbbbbbbbbbbbbbbbbbbbbbbbbbbbbbbbbbbbbbbbbbb","page_or_span":"p. 6, §5","source_revision":4,"occurrence_id":"OCC-OBJECT-001"}],"question_ids":["QUESTION-001"],"pericial_object_ids":["OBJECT-001"],"court_decision_ids":[],"technical_document_reference_ids":[],"gap_or_conflict_ids":[]},
      "proposal_status":"PROPOSED","professional_review_status":"PENDING","quantity":"dimensão linear","unit":"mm","purpose":"Produzir dado mensurável para futura análise"
    }
  ],
  "photo_requirements": [
    {
      "item_id":"PLAN-PHOTO-001","title":"Registro fotográfico proposto","description":"Planejar fotografias de orientação e detalhe do objeto.","priority":"MEDIUM",
      "derivation":{"rationale":"O objeto deve ser documentado durante a futura inspeção.","case_analysis_item_ids":["OBJECT-001"],"source_provenance":[{"workspace_id":"11111111-1111-4111-8111-111111111111","source_document_id":"DOC-002","source_document_sha256":"bbbbbbbbbbbbbbbbbbbbbbbbbbbbbbbbbbbbbbbbbbbbbbbbbbbbbbbbbbbbbbbb","page_or_span":"p. 6, §5","source_revision":4,"occurrence_id":"OCC-OBJECT-001"}],"question_ids":[],"pericial_object_ids":["OBJECT-001"],"court_decision_ids":[],"technical_document_reference_ids":[],"gap_or_conflict_ids":[]},
      "proposal_status":"PROPOSED","professional_review_status":"PENDING","subject":"Objeto e detalhes relevantes","purpose":"Preservar contexto visual futuro"
    }
  ],
  "equipment_requirements": [
    {
      "item_id":"PLAN-EQUIPMENT-001","title":"Instrumento de medição candidato","description":"Disponibilizar instrumento compatível com a medição proposta.","priority":"MEDIUM",
      "derivation":{"rationale":"A medição proposta exige instrumento apropriado.","case_analysis_item_ids":["QUESTION-001","OBJECT-001"],"source_provenance":[{"workspace_id":"11111111-1111-4111-8111-111111111111","source_document_id":"DOC-001","source_document_sha256":"aaaaaaaaaaaaaaaaaaaaaaaaaaaaaaaaaaaaaaaaaaaaaaaaaaaaaaaaaaaaaaaa","page_or_span":"p. 7, item 1","source_revision":4,"occurrence_id":"OCC-QUESTION-001"},{"workspace_id":"11111111-1111-4111-8111-111111111111","source_document_id":"DOC-002","source_document_sha256":"bbbbbbbbbbbbbbbbbbbbbbbbbbbbbbbbbbbbbbbbbbbbbbbbbbbbbbbbbbbbbbbb","page_or_span":"p. 6, §5","source_revision":4,"occurrence_id":"OCC-OBJECT-001"}],"question_ids":["QUESTION-001"],"pericial_object_ids":["OBJECT-001"],"court_decision_ids":[],"technical_document_reference_ids":[],"gap_or_conflict_ids":[]},
      "proposal_status":"PROPOSED","professional_review_status":"PENDING","equipment":"Instrumento dimensional a selecionar","purpose":"Apoiar medição futura"
    }
  ],
  "access_requirements": [
    {
      "item_id":"PLAN-ACCESS-001","title":"Acesso ao local","description":"Confirmar autorização e condições de acesso antes da diligência.","priority":"HIGH",